recommendationid,language,review,timestamp_created,timestamp_updated,voted_up,votes_up,votes_funny,weighted_vote_score,comment_count,steam_purchase,received_for_free,written_during_early_access,primarily_steam_deck,author.steamid,author.num_games_owned,author.num_reviews,author.playtime_forever,author.playtime_last_two_weeks,author.playtime_at_review,author.last_played,author.deck_playtime_at_review
201644998,english,It's alright,1754583116,1754583116,True,0,0,0.5,0,True,False,False,False,76561198834194606,0,11,151451,6009,151451,1754167447,
201640033,english,"Its not without its problems, but this is easily my favorite game ever",1754578048,1754578048,True,0,0,0.5,0,True,False,False,False,76561198260132084,0,2,58854,16,58838,1754578415,
201633093,english,276 hours and counting.,1754570478,1754570478,True,0,0,0.5,0,True,False,False,False,76561198011714319,0,6,16604,2,16604,1754570461,
201632844,english,"The intro was pretty good, but I needed to install 50+ mods to enjoy the actual game",1754570172,1754570172,True,0,0,0.5,0,True,False,False,False,76561199121217964,0,18,1522,1,1522,1754597822,
201631617,english,One of the greatest game i have ever played. I played this on my steam deck and it is great you can do what you can.,1754568733,1754568733,True,0,0,0.5,0,True,False,False,True,76561199585356478,42,3,402,402,402,1754581954,402.0
201630727,english,"inatla brotherhood'a katılmayıp, railroad'la herkesin içinden geçtiğim bir 44 saatlik serüven. daha ne kadar verimli olunabilir ki..",1754567572,1754567587,True,0,0,0.5,0,True,False,False,False,76561198275490380,140,19,2660,988,2660,1754567146,
201629783,english,"Game is 10 years of age.  Should be considered/marketed as a classic, not as the newest latest greatest junk.",1754566391,1754566391,False,3,0,0.515427529811859131,0,True,False,False,False,76561199529373526,0,7,5727,168,5727,1754558028,
201625571,english,Great game,1754560444,1754560444,True,0,0,0.5,0,True,False,False,False,76561198453518541,393,172,17438,0,17438,1717237390,
201623777,english,"This game is a fantastic RPG that balances intense combat, deep customization, and rich storytelling. While it has some flaws, its vast world, replayability, and mod support make it a timeless adventure. 9/10 – Highly Recommended!

""War never changes… but Fallout 4 makes it incredibly fun."" 🚀💀",1754557762,1754557762,True,0,0,0.5,0,True,False,False,False,76561198186775867,0,1,6571,1241,6571,1754550994,
201623035,english,Working well on GNU/Linux,1754556625,1754556625,True,0,0,0.5,0,True,False,False,False,76561198025568339,0,1,2005,2005,1160,1754610106,
201619007,english,works great,1754549643,1754549643,True,0,0,0.5,0,True,False,False,True,76561199383344292,0,2,1281,339,1263,1754552039,1263.0
201617646,english,Yo i shot up a whole settlement,1754547145,1754547145,True,0,0,0.5,0,True,False,False,False,76561199794527121,0,5,344,344,222,1754596575,
201616567,english,"""It's all over, but the crying... and nobody's crying, but me.""
Despite the story not being the greatest, It's still a fun time to build settlements and go on quest to further progress the story of your survivor.",1754545149,1754545149,True,0,0,0.5,0,True,False,False,False,76561199213509924,0,4,8714,0,8714,1743574114,
201615415,english,BRST FUCKING GAME EVER MADE,1754543071,1754543071,True,0,0,0.5,0,True,False,False,False,76561199814650937,0,1,112,112,112,1754542517,
201614739,english,litttttyyy aaaasssss aaaaa ttitttttyyy,1754541949,1754541949,True,0,0,0.5,0,True,False,False,False,76561198376880024,0,11,422,63,359,1754549084,
201614491,english,"I'm convinced you can literally play this game for YEARS on end and not get bored. 10/10, even without mods, this game is just excellent. The main highlight for me is VATS and how your choices actually have a major role in effecting the world around.",1754541496,1754541496,True,0,0,0.5,0,True,False,False,True,76561197970693780,0,4,1999,1428,1840,1754551233,1627.0
201614314,english,best fallout game,1754541187,1754541187,True,0,0,0.5,0,True,False,False,False,76561199111612604,112,4,6151,0,6151,1739941520,
201613707,english,Good game.,1754540164,1754540164,True,0,0,0.5,0,True,False,False,False,76561198260734416,0,8,18750,0,18750,1745032501,
201612748,english,"Probably the most dang glitchy freakin game I've played in a bit, but had a lot of fun at the same time.",1754538616,1754538616,True,0,0,0.5,0,True,False,False,False,76561198831411487,0,3,6333,1489,6317,1754539592,
201612595,english,Power armor,1754538389,1754538389,True,0,0,0.5,0,True,False,False,False,76561199200980123,0,1,13056,8810,12892,1754548243,
201611222,english,My feelings on this game have had more character development than The Railroad,1754536226,1754536226,True,1,0,0.509293675422668457,0,True,False,False,False,76561197976934476,201,88,1206,1206,22,1754608635,
201609782,english,this game is a legend,1754533967,1754533967,True,0,0,0.5,0,True,False,False,False,76561198161051515,0,4,7245,361,7241,1754535727,
201608846,english,The best Fallout.,1754532530,1754532530,True,0,0,0.5,0,True,False,False,False,76561198329608119,0,1,1358,1358,1358,1754532381,
201606844,english,"Over 2,500 hours between Xbox and PS5. Going to put another 2,500 hours on PC.",1754529371,1754529371,True,0,0,0.5,0,True,False,False,False,76561198357382019,0,1,1267,638,1185,1754534271,
201606003,english,one of the best open world games i have played,1754528072,1754528072,True,1,1,0.523809552192687988,0,True,False,False,False,76561198206686208,0,1,114168,2480,113722,1754595341,
201604392,english,"You don't play this for the game.

You buy this and the expansions so that you can then spend the next week trying to get that one kink mod you stumbled across to work, and have the greatest gaming fap possible.

That or, you try to acquire 200 ish mods to make the story and gameplay half decent, you freak.",1754525560,1754525560,True,0,0,0.5,0,True,False,False,False,76561198082250655,245,44,20433,0,20433,1749536489,
201600779,english,vary good,1754520959,1754520959,True,0,0,0.5,0,True,False,False,False,76561199455230391,12,5,1298,1298,791,1754602458,
201598807,english,i think its fun,1754518372,1754518372,True,0,0,0.5,0,True,False,False,False,76561199516270453,10,4,781,782,664,1754525467,
201595578,english,"I had a lot of good memories with this game until a patch obliterated mod support. The underlying problem isn't Bethesda's decision to make their code proprietary, it's that the way they went about it was an intential middle finger to all the fans who loved their game so much they created passion projects to enhance the Commonwealth experience. It's a pretty good game when you play vanilla but, as is often the case, mods make it shine a lot more. That combined with the clearly fake upvotes from Bethesda numbering in the tens of thousands ruined the overall experience for me. I won't go so far as to say I'll never buy a Bethesda game again but I certainly won't preorder or go in blind ever again. Pre-game-breaking patch, 7.5/10. Currently, 1/10 and that's me being generous.",1754514487,1754514487,False,0,0,0.5,0,True,False,False,False,76561198084232115,666,5,18120,68,18120,1754085930,
201591518,english,It just works,1754509860,1754509860,True,0,0,0.5,0,True,False,False,False,76561198154586696,90,12,22236,52,22184,1754517971,
201590485,english,"I haven’t gotten very far in this game, but even still I can very confidently say that this game is great. The graphics are amazing, the combat feels nice, the story is pretty good, I don’t really have anything bad to say about it. 

Argueably, I would say Fallout 4 is better than New Vegas, some people may not agree with me on this though.",1754508833,1754508833,True,0,0,0.5,0,True,False,False,False,76561199127134211,62,1,169,169,169,1754504528,
201588087,english,"Classic Fallout-questionable NPCs, armpit-deep lore, an entertaining main storyline and endless sidequests you can use to kill time. Already owned it for PS5 but the moment i learned it supports crowd control i downloaded it on PC too. Let me tell you-best mistake i have ever made. In spite of Bethesda's reputation for bugs, glitches, and crashes, this game handles 800 enemy spawns and 300 melons exploding from your pockets (god, i hope it's from my pockets, actually) suspiciously well. But please don't let that scare you away! If you love the notorious fails, your character and every other character you interact with periodically freezes in hilarious poses and moves like a haunted chess piece across the map for absolutely no reason, so the tech failure you know and love is still very much present. 10/10, would crash again.",1754506402,1754506402,True,0,0,0.5,0,True,False,False,False,76561199836925366,0,3,518,1,518,1754244511,
201583989,english,Great addition to the fallout series and worth playing. Only complaint is the story being possible to sideline and not able to properly progress through after leaving the vault. It's been so long since its come out and it still has its fun and quirkiness. Lot of frame drops here and there though especially around Boston.,1754502067,1754502067,True,0,0,0.5,0,True,False,False,False,76561198842080212,0,7,958,413,958,1754166317,
201580334,english,shitty writing,1754498254,1754498254,True,0,0,0.5,0,True,False,False,False,76561198301295313,86,46,3114,0,3114,1744538791,
201580088,english,Good fallout game but it lacks the special weapons from fnv and replaces them with rng shit,1754497980,1754497980,True,0,0,0.5,0,True,False,False,False,76561199245977294,0,12,10323,0,10323,1750387690,
201578639,english,So much content and then theres the mods love them,1754496490,1754496490,True,0,0,0.5,0,True,False,False,False,76561198079581674,0,1,24124,7026,23041,1754598198,
201577590,english,Good,1754495431,1754495431,True,0,0,0.5,0,True,False,False,False,76561198159412964,162,3,2936,176,2760,1754589576,
201577075,english,i love gooning to mama murphy,1754494892,1754494892,True,0,0,0.5,0,True,False,False,False,76561199085986912,33,26,250,250,208,1754550269,
201576130,english,prepair for august 8,1754493909,1754493909,True,0,0,0.5,0,True,False,False,False,76561199181357504,0,18,420,420,207,1754581688,
201575948,english,A legend. One of the greatest games ever made.,1754493725,1754493725,True,0,0,0.5,0,True,False,False,False,76561198033564585,0,122,355,185,169,1754590953,
201572029,english,"classic. no relly a fallout but fun
",1754489746,1754489746,True,0,0,0.5,0,True,False,False,False,76561198384715514,56,1,9677,1933,9109,1754609871,
201571134,english,"mald over your dead son and kill 1000 raiders while traversing through the dog shit story
help the minutemen by going to that settlement marked on your map
play anything else published by bethesda",1754488759,1754488759,True,0,0,0.5,0,True,False,False,False,76561199753579588,0,22,3312,0,3312,1752902895,
201569399,english,If you're gonna play this game do it with mods.,1754486955,1754487196,True,0,0,0.5,0,True,False,False,False,76561199521763294,0,7,12131,1494,11906,1754553588,
201568826,english,"With mods, I can now choke slam a child, thank you Bethesda.",1754486299,1754486299,True,0,0,0.5,0,True,False,False,False,76561199157446069,31,11,2748,2748,2526,1754575274,
201566205,english,"Easy to lose yourself and roleplay this game, also tons of funny moments.",1754483158,1754483158,True,0,0,0.5,0,True,False,False,False,76561198081343247,0,3,456078,265,456078,1754230421,
201563392,english,trash,1754479600,1754479600,False,2,1,0.528985500335693359,3,True,False,False,False,76561198158146574,0,12,6922,1949,6922,1754479577,
201563111,english,Play with mods,1754479230,1754479230,True,0,0,0.5,0,True,False,False,False,76561198354084111,19,14,4573,8,4565,1754479727,
201555419,english,"class game, keeps you busy for hours",1754467307,1754467307,True,0,0,0.5,0,True,False,False,False,76561199007218413,0,3,76069,9498,74584,1754609560,
201552981,english,I got this game on ps5 and now I have it on pc for mods but all the mods are rule 34 mods so now I gotta beat the game like I did on ps5 but just on mnk with medium graphics still peak though and I will buy all the dlc's again just to see cate in the nuka girl outfit,1754462824,1754462824,True,0,0,0.5,0,True,False,False,False,76561199867802970,0,1,369,369,181,1754608093,
201546867,english,"i like games like this that allow you to bring out your creative side
",1754452089,1754452089,True,0,0,0.5,0,True,False,False,False,76561198024562333,41,2,356,356,205,1754609836,
201544953,english,hell ye,1754449033,1754449033,True,1,0,0.509803950786590576,0,True,False,False,False,76561198324983924,0,11,1399,1399,555,1754608985,
201541489,english,"Story is weak, good game play, with mods tune the game to your taste",1754444063,1754444063,True,0,0,0.5,0,True,False,False,False,76561199210512729,0,1,17489,29,17459,1754451465,
201541133,english,fallout :),1754443555,1754443555,True,0,0,0.5,0,True,False,False,False,76561199008530486,29,10,883,883,502,1754600297,
201540769,english,Hellllllllllllll yeahhhhh dood,1754443066,1754443066,True,0,0,0.5,0,True,False,False,False,76561199860365753,0,7,741,741,601,1754535660,
201540708,english,i got jumpscared by a legendary deathclaw and got absolutely destroyed. i love this game,1754442991,1754442991,True,0,0,0.5,0,True,False,False,False,76561198447388569,0,4,3122,987,2550,1754596228,
201540582,english,fall foor,1754442786,1754442786,True,0,0,0.5,0,True,False,False,False,76561199195777512,0,14,492,136,356,1754499796,
201539192,english,The game keeps crashing. I have more than enough power to run the game. I'm going to see if I can get a refund.,1754440694,1754440694,False,0,0,0.5,0,True,False,False,False,76561198053724054,41,13,166,166,166,1754440607,
201538142,english,"Been playing for more than 50 hours now and am not near the end one bit. Although it can be a repetitive quest game from time to time, it is also a wonderful title that is easy to get lost inside. I heavily recommend buying the deluxe edition because the DLCs look fire, and on sale they can go for pretty cheap. Overall this game is a heavy yes for me and I love getting into all the lore of this nuclear wasteland.",1754439171,1754439171,True,0,0,0.5,0,True,False,False,False,76561199403561129,0,2,3667,1027,3491,1754526352,
201537905,english,"bad game unless you download 100+ mods, then its just okay",1754438865,1754438865,True,0,0,0.5,0,True,False,False,False,76561198952585263,0,10,89229,495,89229,1754183452,
201537557,english,fireeeeeeee,1754438344,1754438344,True,0,0,0.5,0,True,False,False,False,76561199879206711,0,2,1465,571,1402,1754442105,
201536198,english,....,1754436479,1754436479,True,0,0,0.5,0,True,False,False,False,76561198981243977,0,3,34645,1651,34465,1754550952,
201533562,english,"Game's 10 years old and everything you already know about it is true. Its buggy, its full of plot holes, it lacks RPG elements that some look for, and its still fun.",1754433028,1754433028,True,0,0,0.5,0,True,False,False,False,76561198068102280,181,3,11855,2518,11471,1754536340,
201532759,english,that's peak,1754432329,1754432329,True,0,0,0.5,0,True,False,False,False,76561199666566113,0,2,14335,361,14335,1754405708,
201527837,english,very good,1754426586,1754426586,True,0,0,0.5,0,True,False,False,False,76561199643538560,0,4,1236,404,1020,1754605121,
201526647,english,:3,1754425359,1754425359,True,0,0,0.5,0,True,False,False,False,76561199845062477,16,2,2258,168,2154,1754560792,
201524339,english,. ݁₊ ⊹ . ݁ ⟡ ݁ . ⊹ ₊ ݁.,1754423034,1754423034,True,0,0,0.5,0,True,False,False,False,76561198803778360,0,7,27990,0,27990,1725416612,
201523972,english,"69 hours, nice",1754422651,1754422651,True,0,0,0.5,0,True,False,False,False,76561199107528104,0,14,4453,774,4170,1754593622,
201521980,english,"So far the smoother game on the franchise. Captivating plot, low lags, immersive milieu.",1754420534,1754420534,True,0,0,0.5,0,True,False,False,False,76561199792678285,0,2,3797,3797,1985,1754609771,
201520641,english,"Honestly, feels like a step-down from Skyrim graphics and gameplay-wise. The story is interesting but that's always the strongest point about any Fallout game. Modding scene is big - but not comparable to Skyrim. The (player) models are also somehow worse than Skyrim... load times are also insanely long - Skyrim with 150+ mods loads faster than vanilla FO4 (same drive - honestly not sure what FO4 is taking so long to render...) 

I wish it were a better New Vegas or a Skyrim with guns - but it fails to be either: the world isn't as intriguing as New Vegas and the gameplay is nowhere near as smooth/accurate as Skyrim (which had its own issues, but it still feels better). 

Gun play is okay - same as New Vegas, maybe a bit better. But there are still some UI glitches in Fullscreen mode that can lead to shooting where your crosshair isn't pointing. 

It's decent, if you're into Fallout it's better than 76. But New Vegas remains unmatched in terms of atmosphere, story, and world. 

Get the GOTY on sale and try it out for yourself.",1754419132,1754419132,False,0,0,0.477941185235977173,0,True,False,False,False,76561198342142571,0,10,609,609,609,1754247015,
201519735,english,It's Fallout,1754418221,1754418221,True,0,0,0.5,0,True,False,False,False,76561197964981895,0,28,27473,39,27473,1754340010,
201516409,english,"9/10, good game",1754414766,1754414766,True,0,0,0.5,0,True,False,False,False,76561199802537156,0,3,2786,1137,2578,1754514784,
201512698,english,"Honestly, this is a pretty good game, i've wanted to play it for soo long and i was finally able to buy it, and i don't regret buying it at all, its a lot of fun and i love the vibes it has with the environment and such, i definitely recommend it that people should try it at least once, if they want to",1754411162,1754411162,True,0,0,0.5,0,True,False,False,False,76561199260077547,0,2,920,931,243,1754600416,
201512199,english,Enjoyed Fallout 4 when it came out.  Getting this many years later with all the dlc it was like a new game.  Just beware all the data makes load times a bit a pain.,1754410653,1754410653,True,0,0,0.5,0,True,False,False,False,76561198009189849,0,2,11782,5002,9821,1754609843,
201510135,english,VERY GOOD,1754408613,1754408613,True,0,0,0.5,0,True,False,False,False,76561198405222641,0,5,4089,2270,3675,1754594079,
201509382,english,"i know i know, bethesda is crap. the main story quest is....questionable at best. but where this game really shines is having some of the highest quality mods of any bethsoft game, even skyrim. download wabbajack and try a FO4 mod pack there, it installs everything for you, takes all the trial and error and guess work of getting a mod list to work. you'll have fun, trust me. I have like 400 hours on record in this game and I've played through the main quest exactly once ( ͡° ͜ʖ ͡°)",1754407876,1754407876,True,0,0,0.5,0,True,False,False,False,76561198043656123,246,10,24798,2956,23615,1754609229,
201508033,english," Having played dozens of characters in Fallout 4 . The older version and the new. I can say it is a good game. But if you want to have REAL FUN a great game. You have to play the game with Power Armor and Sword. Power armor  T51 is best, easy to repair and upgrade.  General Chaos sword at Trudys, use tire iron untill you buy the sword. Pistol any for those turrents on roofs. Molotovs for flying bugs. And Yao Guai Roast for massive damage. Next ignore the rest of the game. Main quest, minutemen, Railroad and Brotherhood of steel they are a waste of time. As for the DLCs. Trash can all of them they are a waste of time are worse. Use Power Armor and Sword and have a really Great game.",1754406584,1754406584,True,0,0,0.5,0,True,False,False,False,76561199877873221,0,1,5326,3273,4741,1754600029,
201507415,english,It is a really great game and it is fun to play.,1754405980,1754405980,True,0,0,0.5,0,True,False,False,False,76561199075587451,105,50,1346,1346,361,1754588352,
201498611,english,"It is very good. I love the open world type stuff, and hopefully I will get some mods for this game, and then I will have some fun with new weapons and other stuff that improves or changes the world and some encounters.",1754396410,1754396410,True,0,0,0.5,0,True,False,False,False,76561198867008512,66,40,311,311,219,1754581625,
201497862,english,Actually fun when some whiny baby isn't telling you it sucks,1754395510,1754395510,True,0,0,0.5,0,True,False,False,False,76561198432649261,115,30,4639,0,4639,1715958072,
201496621,english,its aight ig...,1754394032,1754394032,True,0,0,0.5,0,True,False,False,False,76561199234010481,92,10,17249,0,17249,1747687175,
201492720,english,What more could you ask for in a fallout game,1754388652,1754388652,True,0,0,0.5,0,True,False,False,False,76561199678754249,87,6,2363,924,2192,1754552521,
201492340,english,Changing the course of the Fallout IP to bog-standard gameplay and story. Plus its optimised like shit. Fuck you.,1754388128,1754388128,False,0,1,0.5,0,True,False,False,False,76561198097815189,0,17,1119,0,1119,1751504160,
201492160,english,"Play this game on console. It's buggy as hell, the fucking NPC travel mates don't even keep up with you and the gun play is also ass. Borderlands 2 is a much better shooter. Also, the V.A.T.S system is kinda bad as well since the fucking character doesn't even hit half the time. But hey, it's not a bug, it's a feature. Don't play fallout on PC. It's trash and I wouldn't recommend.",1754387846,1754387846,False,0,0,0.5,0,True,False,False,False,76561199238175380,48,5,365,348,365,1754387678,
201491500,english,you're usually supposed to take what you learned working on previous games and apply that knowledge and effort to improve upon your future games,1754387136,1754387136,False,0,0,0.5,0,True,False,False,False,76561198204729073,127,8,253,0,253,1715478793,
201487047,english,,1754380467,1754380467,True,0,0,0.5,0,True,False,False,False,76561199366280573,34,1,1875,1875,1875,1754376713,
201486417,english,good quality easy to learn,1754379420,1754379420,True,0,0,0.5,0,True,False,False,False,76561199877980152,0,1,263,263,263,1754379370,
201484703,english,"I MEAN THIS GAME IS GOOD TO PAST THROUGH TIME THO......
",1754376455,1754376455,True,0,0,0.5,0,True,False,False,False,76561199786088227,0,1,2598,2593,1395,1754551704,
201483438,english,good very nice. power armor = very good. a bunch of different power armor types = VERY VERY GOOD :D,1754374300,1754374300,True,0,0,0.5,0,True,False,False,False,76561199562732414,0,5,1855,337,1855,1754374089,
201482338,english,"I would say I've had fun with this game, story was a little weak here or there but generally the gameplay was pretty good (except minutemen faction's gameplay). Also the game is VERY modable (nexus mods is where to get all the good stuff).

The base game story had interesting aspects to it but sometimes suffered from poor writing (example being the institute wanting to help the commonwealth yet released super mutants into the commonwealth and father stepping outside for the first time and just saying the the commonwealth is beyond saving). 

Nuka World: Weak gameplay (mostly go to attraction plant raider gang flag), theme was cool I just wish gameplay was better.

Fah Habah (Far Harbor): Generally really good, reminded me of point lookout in fallout 3. Spooky atmosphere, with a very morally challenging choice for the main quest. I honestly thought this DLC was really good.

The others: The other DLC's prioritized settlement building over actual story which kinda sucks in my opinion.

Automatron: Short little side quest, allowed for the creation of silly robots like my creation ""Princess"" and ""Clanka""

Vault-tec workshop: You get to build a vault and do ethically questionable experiments (wow....)

The other ones: IDK probably just settlement building stuff

Creation club: Cool except for the fact they are essentially paid-for mods, some are free like Enclave Remnants which is okay in my opinion.

I'd say generally the gameplay is good, and the mods that you can get make this game worth getting and playing I just wish the story was a bit more refined and DLCs more story oriented (building is fun, but story is more important in a fallout game, look at the DLCs for New Vegas or even Fallout 3 compared to the ones in this game, I'd say the older ones were more interesting). I don't hate building but I find the story of Fallout games to be more interesting. Again you can get this game (G.O.T.Y edition) for cheap in 2025, and it is very fun (but definitely get mods to enhance the experience, and remember when installing mods be careful and don't be afraid to watch guides / mod reviews to help install them. 

Note: I have no acheivements as of writing this because it was modded.",1754372401,1754372614,True,0,0,0.5,0,True,False,False,False,76561199215586571,0,20,5009,5009,5009,1754371026,
201481711,english,This is the best fallout game. New vegas being second. So much to do and a lot of endings! GET THE FAR HARBOR DLC you won't regret!!!,1754371288,1754371288,True,0,0,0.5,0,True,False,False,False,76561198070740136,49,28,13878,233,13878,1754371227,
201481083,english,"Not currently playable after recent updates. At least on my PC. Thought it was a mod issue crashing the game every 2 minutes. Flat fresh reinstalled, no mods; nope - it is just the game being unplayable. L bethesda as usual.

9950x3d
RTX 5080",1754370196,1754385608,False,0,0,0.5,0,True,False,False,False,76561197997457310,0,29,16759,31,16759,1754370038,
201480877,english,"10 years later.
Launch Fallout 4....
Set it to fullscreen.
It opens in a window.
I try every fix on the internet.
INI tweaks, launch options, compatibility mode, dark rituals.
Nothing works.
Still windowed.
Some games age like wine.
Fallout 4 aged like milk in a nuclear fridge.
""It just works.""",1754369864,1754369864,False,0,0,0.5,0,True,False,False,False,76561198231388748,0,32,13,0,13,1723373611,
