recommendationid,language,review,timestamp_created,timestamp_updated,voted_up,votes_up,votes_funny,weighted_vote_score,comment_count,steam_purchase,received_for_free,written_during_early_access,primarily_steam_deck,author.steamid,author.num_games_owned,author.num_reviews,author.playtime_forever,author.playtime_last_two_weeks,author.playtime_at_review,author.last_played,author.deck_playtime_at_review
201317208,english,"Great open world, third person shooter, the quest are good and the enemies are challenging especially a building full of super mutants!",1754172151,1754172151,True,0,0,0.5,0,True,False,False,False,76561199839948600,0,1,2326,1236,2007,1754447001,
201314951,english,its good,1754169720,1754169720,True,0,1,0.5,0,True,False,False,False,76561198190044881,0,5,521,527,405,1754289707,
201314271,english,RUFF RUFF I BUILD SHIT,1754169016,1754169016,True,0,0,0.476190477609634399,0,True,False,False,False,76561199051961157,118,21,13593,0,13593,1750791913,
201314176,english,"A hollow shell with vapid writing. There's a better game somewhere in here, but this isn't it. Still, it's a Bethesda sandbox, so there's plenty to do.",1754168927,1754168927,False,5,1,0.520999729633331299,0,True,False,False,False,76561198001003149,274,25,13834,1758,13295,1754609476,
201312851,english,"It's a classic BETHESDA Game set in the Fallout Universe. It may not be perfect straight out of the box, but the modding community has seen fit to smooth out the roughest parts and put a coat of polish on the game.",1754167544,1754167544,True,0,0,0.5,0,True,False,False,False,76561198052429208,1150,5,26256,573,25875,1754299377,
201312048,english,best,1754166739,1754166739,True,0,1,0.5,0,True,False,False,False,76561198211486615,0,2,7565,397,7565,1754163655,
201310916,english,Totally Awesome!!,1754165627,1754165627,True,0,1,0.5,0,True,False,False,False,76561199832490408,0,2,2592,1684,2365,1754350852,
201309639,english,I've only beaten the game 4 times.,1754164330,1754164330,True,0,1,0.5,0,True,False,False,False,76561198069039484,0,8,81566,0,81566,1751058123,
201309433,english, it was fun with mods :),1754164125,1754164125,True,0,0,0.5,0,True,False,False,False,76561198256284633,0,7,7625,1095,7603,1754165715,
201308106,english,But can one play it on their Rocket 69?,1754162823,1754162823,True,0,0,0.5,0,True,False,False,False,76561199046157772,0,3,3568,0,3568,1750014406,
201305579,english,good,1754160287,1754160287,True,0,0,0.5,0,True,False,False,False,76561199753081693,0,3,976,976,274,1754291045,
201303234,english,"It's a huge world, lots of make-your-own-way opportunities, plenty left to discover even after multiple play-throughs.",1754157958,1754157958,True,0,0,0.5,0,True,False,False,False,76561197997348980,0,2,16549,1666,14882,1754435054,
201300624,english,boring game with very little story and bad,1754155507,1754155507,False,0,0,0.47826087474822998,0,True,False,False,False,76561199349118597,0,3,50,0,50,1751522235,
201297950,english,"You know, for a while I believed all of the people who told me this game was bad, because it wasn't ""as good as 3 or New Vegas."" Forget all that. This game is great. I had a lot of fun with it, and I even made a couple of levels in it using Creation Kit. If you're a Fallout fan on the fence, use this review to tip the scales in favor of buying this game. Especially if it's on sale.",1754153065,1754153065,True,0,0,0.5,0,True,False,False,False,76561198055104164,0,10,6269,54,6269,1754088111,
201297880,english,fire game,1754153006,1754153006,True,0,0,0.5,0,True,False,False,False,76561199813916741,0,4,308,308,279,1754333031,
201296701,english,"The latest version tho seems liked 'filtered', like its more 'friendly' to the audience. My character isn't that sarcastic esp when skipping dialogues.",1754151912,1754151912,True,0,0,0.5,0,True,False,False,False,76561198133014427,0,4,316,316,198,1754493938,
201293293,english,X-02 power armor is really cool. I like power armor.,1754148870,1754148870,True,0,0,0.5,0,True,False,False,False,76561199552011503,9,2,958,342,727,1754452200,
201293025,english,yes,1754148639,1754148639,True,0,0,0.5,0,True,False,False,False,76561198060787821,0,6,13551,177,13520,1754222999,
201291888,english,falllout4,1754147623,1754147623,True,0,0,0.5,0,True,False,False,False,76561199553866328,31,19,941,941,816,1754572695,
201291836,english,"i don't think this game deserves anything when i can't even set a fullscreen.
honestly, i tried everything, every guide on the internet, every youtube video, nothing helped.
it was launching on a small window and nothing could've fixed the problem.
it was a thing in 2021, it is a thing right now.
even if i'll fix it, even if i'll spend another 100 hours in this game i wont remove this negative review because i don't think developers who can make an entire game but can't make it run fullscreen deserve to have a positive one.",1754147569,1754147569,False,0,0,0.5,0,True,False,False,False,76561199526402038,0,8,10,10,9,1754147711,
201289221,english,"I used to play fallout when i was a kid. There was always this filling that i had at  that age when i played this game a filling of peace freedom and much more that i felt when i was small. Now that Im much older 17 life is good but its hard for me. But when i play this game i fill like that kid again when i did't have to worry about anything . when i only had to worry about my mom and what time she will be getting home. Sometime she got home late like 3-5 minutes  late. I would freak out because i though she got killed in a car crash fr. But to anyone that thinks this game doesn't look good or don't looks interesting its amazing. again It's never bad to try somthing new your never know inless you try >
",1754145255,1754145255,True,0,0,0.5,0,True,False,False,False,76561199023030799,95,3,3714,1,3714,1754163662,
201288905,english,I made Jan rich in this game more than +9 years ago.,1754144941,1754144941,True,0,0,0.5,0,True,False,False,False,76561199547132799,0,5,202,1,202,1754144434,
201288024,english,This was the first game that I have played on Linux using Proton. It plays really well. The game itself is awesome.,1754144107,1754144107,True,0,0,0.5,0,True,False,False,False,76561197998355156,0,24,3002,1656,1896,1754596231,
201285313,english,Peak. Absolute cinema. Have almost 300 hours.,1754141504,1754141527,True,0,0,0.5,0,True,False,False,False,76561199838935074,0,1,15929,1,15929,1754011069,
201277230,english,"The Ikea furniture of games, had to mod in my enjoyment",1754132999,1754132999,False,0,0,0.5,0,True,False,False,False,76561198969832759,139,15,12574,0,12574,1745292377,
201276184,english,"Fun game with an O.K. story. DLC’s are a nice addition. Far Harbour is what carried this game in my oppinion.

100%’ed this game, but man some achievements are not worth it.",1754131741,1754131741,True,0,1,0.5,0,True,False,False,True,76561198092508096,43,10,5240,509,5240,1754130611,5236.0
201275411,english,"上头（）真正的经典神作

不过值得注意的是上古时期的读写优化极差，从副本回到大地图加载能超过半分钟（我最好的西数黑盘也救不回来）
配合上STEAM幽默的卡云同步问题，显得更加幽默了
P.S. 在steam-设置-下载- 关掉最下方的 预加载着色器缓存，能极大幅度提升启动速度，估摸着这byd是个没修的bug （也不是域名污染的问题，挂梯子并不会解决这一步的卡顿）",1754130759,1754386280,True,0,0,0.5,0,True,False,False,False,76561198303521373,0,40,3465,3369,2504,1754585466,
201271795,english,Going back to see where the 300hrs came from because I don't remember beating it. 10/10,1754126286,1754126286,True,0,0,0.5,0,True,False,False,False,76561198223863348,442,16,18163,9,18154,1754127768,
201263771,english,The BEST Fallout Game,1754115249,1754115249,True,0,0,0.5,0,True,False,False,False,76561199031299690,0,11,26597,17,26597,1753666187,
201261642,english,"best game ever made
",1754112037,1754112037,True,0,0,0.5,0,True,False,False,False,76561198181753958,121,13,5283,14,5269,1754115134,
201258612,english,sucks,1754107828,1754107828,False,0,2,0.5,0,True,False,False,False,76561198907191577,0,5,14889,1,14889,1754101442,
201258437,english,"Didn't start this game one PC. I LOVE IT! I'd play at my friend's house when I was younger. Playing it on my own PC brings back unimaginable nostalgia. Love, love, love. One of the best games created.",1754107576,1754107576,True,0,0,0.5,0,True,False,False,False,76561198889513144,116,49,2445,0,2445,1724897490,
201257293,english,Ver Good,1754106052,1754106052,True,0,0,0.5,0,True,False,False,False,76561198348746973,0,9,12108,75,12036,1754110344,
201256999,english,"I don't get why fallout fans don't like this one. I can understand many of the complaints, mainly the mediocre story and loss of many classic rpg mechanics. However, the improved gameplay and graphics make up for that, imo. With the more modern combat mechanics, this game is plenty fun and holds its own as a solid fallout game.",1754105663,1754105663,True,0,0,0.476190477609634399,0,True,False,False,False,76561198311840460,564,40,6494,0,6494,1715301681,
201256445,english,the best game in the franchise,1754104909,1754104909,True,0,1,0.476190477609634399,0,True,False,False,False,76561198048868726,0,5,1805,1805,376,1754592338,
201256272,english,One of the best games ever.,1754104653,1754104653,True,0,0,0.5,0,True,False,False,False,76561198243064122,0,5,2612,2199,1586,1754608563,
201255296,english," Great story , fun game play, good value",1754103296,1754103296,True,0,0,0.5,0,True,False,False,False,76561198281121588,0,1,6129,2809,4550,1754569456,
201254768,english,"so its been 10years and i really had my fun in fallout 4 back then the release on xbox one!!!

i played this over 1000+ hrs on xbox and on 350hrs not bad still funny game and i got all achievements so yea its goood 
",1754102593,1754102593,True,0,0,0.5,0,True,False,False,False,76561199390011813,257,22,20970,1,20970,1754008007,
201246898,english,Pretty nice game where you'll never get bored. Although it could use some writing like in New Vegas.,1754092110,1754092110,True,0,0,0.5,0,True,False,False,False,76561199114719591,89,51,7881,5713,3927,1754607589,
201245963,english,"Some mods just don't work anymore with the next-gen update, which, okay whatever. Fun while it lasted. But there's a bunch of new content to check out while we're waiting for Fallout 5.",1754090947,1754090947,True,1,0,0.523809552192687988,0,True,False,False,False,76561199376197643,0,1,847,847,287,1754249278,
201241786,english,good morning sir,1754085997,1754085997,True,0,0,0.5,0,True,False,False,False,76561199622845380,5,1,62,62,36,1754095371,
201239862,english,playing on ally x,1754083881,1754083881,True,0,0,0.5,0,True,False,False,False,76561199811656970,0,1,513,513,189,1754444863,
201237943,english,fun game loading screen just takes long,1754081879,1754081879,True,0,0,0.5,0,True,False,False,False,76561199863798013,0,4,1280,1280,235,1754516552,
201234990,english,I love ts,1754078832,1754078832,True,0,0,0.5,0,True,False,False,False,76561198110041226,23,2,5973,618,5355,1754209407,
201234932,english,"The exploration is a masterclass and the gunplay combined with VATS is fun, but the story... it is just terrible. Honestly, it is hard to believe how bad it is. I love Fallout, it is my favourite gaming franchise (literally), and still I cannot stand the story. It takes me out of the experience constantly. And it also happens to be the Fallout game where it is more difficult to avoid the story. Far Harbor is good, but getting there is a chore. I wish they had the option to start a new playthrough for only Far Harbor, like CD Projekt did with the expansions in The Witcher 3",1754078769,1754078769,False,0,0,0.5,0,True,False,False,False,76561198071018895,27,3,6578,480,6098,1754609979,
201234457,english,"can mod game to have boobs, pretty cool i guess
",1754078220,1754078220,True,0,0,0.5,0,True,False,False,False,76561198295832176,0,5,9924,177,9759,1754309404,
201232660,english,"Very detailed, immersive.",1754076321,1754076321,True,0,0,0.5,0,True,False,False,False,76561198139930566,71,14,2836,878,2384,1754515426,
201227617,english,"The weakest of the “Big 3” but still incredibly fun. The companion system, and pretty much every system has been upgraded and updated. The new settlement system is a welcome respite to the Wasteland and quickly becomes extremely rewarding as you progress. Expect to spend HOURS and HOURS and HOURS in these locations, or just download them via a settlement blueprint on nexus :) 

Nuka-World is one of my favourite DLC’s ever. The rest of them are absolute let downs. I mean, Far Harbour was ok but Automaton and the Vault one was a doozy.   

8/10 
",1754071119,1754071119,True,0,0,0.5,0,True,False,False,True,76561199803981988,264,41,2435,0,2435,1753306569,2435.0
201224756,english,Mods take this from being a good game to a great game.,1754068224,1754068224,True,0,0,0.5,0,True,False,False,False,76561198052392984,0,1,23497,4464,21052,1754609708,
201224216,english,this game is a lot of fun if you dont cheat,1754067625,1754067625,True,0,0,0.5,0,True,False,False,False,76561198201998023,0,5,71961,653,71398,1754195923,
201223142,english,"Probably the worst Fallout.
Still has its moments
",1754066577,1754066577,True,0,0,0.476190477609634399,0,True,False,False,False,76561197988655302,1390,54,12088,5387,9434,1754598760,2733.0
201222738,english,"Entirely devoid of any soul or charm that made 3 and NV great. Barely an RPG anymore, dogwater voice-acting and writing. Vibes are off.",1754066204,1754066204,False,0,0,0.5,0,True,False,False,False,76561198033880063,0,14,100,100,100,1754063770,
201222177,english,"grest gsme would reco,emt",1754065609,1754065609,True,0,0,0.5,0,True,False,False,False,76561198313545898,0,1,4651,80,4611,1754080955,
201220539,english,DOG MEAT!~,1754064077,1754064077,True,0,0,0.5,0,True,False,False,False,76561198300965111,0,13,3299,0,3299,1717571907,
201213186,english,blowing shit up is fun,1754057023,1754057023,True,0,0,0.5,0,True,False,False,True,76561199682767855,0,6,5989,3493,5588,1754524482,4208.0
201213047,english,"Ah yes, splendid",1754056897,1754056897,True,0,0,0.5,0,True,False,False,False,76561199847820302,0,3,2532,2532,479,1754608500,
201212688,english,"Pretty fun. A little buggy but honestly can be overlooked. And also, to the people saying ""black screen when i start it up"" Run it on your desktop. You may need a few mods, but this game is fun. 9.4/10",1754056550,1754056550,True,1,0,0.523809552192687988,0,True,False,False,False,76561199227689314,39,17,533,533,352,1754326440,
201206245,english,"I would not recommend this to anyone who likes RPG's, story driven games or even the fallout universe. I would recommend it to someone who likes fps shooters and looter shooter survival/ base building games and are willing to button smash over incredibly stupid dialogue that is used as an excuse to go somewhere, kill a bunch of things and bring something back, press a button etc.

So the upsides in context of previous fallout games: The engine is much better and smoother than the one in previous 3D fallout games.  That's pretty much it.

Negatives: The world makes no sense and is considerably dumber than in previous fallout games, even compared to FO3. There is zero role play, you get to choose some stats but at the end of day, you'll just go from a to b to shoot stuff. The plot is incredibly boring, linear and poorly written. There is no fun dialogue options and everything is read out in a generic bland voice that is about as interesting as jar of pickles. 

It's not a bad game by any means, it's just a really horrible fallout game.",1754049837,1754049837,False,0,0,0.476190477609634399,0,True,False,False,False,76561197988554562,0,1,84,0,84,1752518617,
201205724,english,how can you not recommend fallout tho,1754049225,1754049225,True,0,0,0.5,0,True,False,False,False,76561198034459654,121,14,513,513,404,1754139996,
201205408,english,"great
",1754048835,1754048835,True,0,0,0.5,0,True,False,False,False,76561199003620096,0,11,3572,695,2877,1754555317,
201202823,english,have you ever wanted to punch someones head off? this is the game for you,1754045555,1754045555,True,1,0,0.523809552192687988,1,True,False,False,False,76561199229502380,0,7,9846,2733,7925,1754601306,
201201956,english,"Ive played 3 hours of this game and its going good so far!

Graphics are good, medium actually works good (I use a Quadro) on low-end pcs
Story kind of depressing though from the start.
Action is yes. FUCK YEAHH MINIGUN
Game size is worth the wait
Radios are interesting
Map is useful
Special perks are cool
Steamdeck support

It's a good game overall",1754044331,1754044331,True,0,0,0.5,0,True,False,False,False,76561199547415737,0,19,1471,1471,205,1754580925,
201195403,english,"Terrible game, nothing works anymore.
All DLC's except High Resolution Texture Pack will softlock your game if you do any of them before finishing story mode or side quests.
If they do not softlock your game which happened in all of my 3 playthroughs they will make your main game story quests or side quests collide with DLC quests making them overlap and disable certain choices you can make in that DLC or kill characters you can save. *This isn't supposed to happen by disable I mean glitch out

Massive amount of overlapping textures

Non-stopping crashes.

Saves can be easily corrupted.

Do not ever install any free add-ons from the Store, Servers litteraly don't work they will either delete all of the items that have that modifications or corrupt your game file.

Stealing a power armor from a dead enemy will immediately make any settlement hostile towards you even though it's yours don't ever use a looted power armor near a settlement.

Dogmeat and all other companions have terrible AI always hitting walls or invisible walls and always getting stuck at doors and making your movement impossible. In some missions there isn't an option to talk to your companions meaning if your companion gets stuck in a small room with you while it's near the door will litteraly softlock the game since there is no way to trigger the companion follow or command it to go anywhere else.

Terrible combat gameplay experience if you have no previous experience playing this game you will fight your own faction at least 17 times while doing side missions. This is side missions not main faction missions game will eventually make you betray a faction(s) if you mention those there is at least 40+ MAIN not side missions in which you litteraly fight the faction you are allied with again.

The swimming physics and animations look like they were exported from a free unity project.

There is just so many more wrong things about this game that I don't remember since I haven't played it over 2 years.
Buy at your own risk.",1754035037,1754035037,False,0,0,0.466666668653488159,0,True,False,False,False,76561198825679633,17,8,1843,0,1843,1752947632,
201193669,english,One of the best wasteland games I ever played but it is a bit buggy and the building system is the weakest part of the game and some of the weapons are ugly when you look more closely except or the assault rifle that thing is a nightmare,1754032143,1754032143,True,0,0,0.5,0,True,False,False,False,76561198304154161,0,14,499,499,315,1754205526,
201191025,english,Best game ever! Captivating story and good combat system.,1754027787,1754027787,True,0,0,0.5,0,True,False,False,False,76561197978158643,67,1,425,425,346,1754038496,
201186566,english,The game is very engaging  i like the modding aspect and the wide range of mods available,1754020964,1754020964,True,0,0,0.5,0,True,False,False,False,76561198429802139,0,3,1329,1329,398,1754599419,
201184007,english,fall on my out till i 4,1754017251,1754017251,True,1,0,0.523809552192687988,0,True,False,False,False,76561199526508042,53,25,2912,60,2852,1754604784,
201182948,english,war never changes,1754015792,1754015792,True,0,0,0.5,0,True,False,False,False,76561198080040392,0,1,10498,4336,7029,1754608416,
201181126,english,"I haven't played this game since it came out, and after roughly 10 years, my feelings are mixed, with most of my nostalgia being quickly squashed. While there is much good to this game, there is also a lot that just didn't seem to age well, and other parts of it that were reminders of things I disliked 10 years ago. 

After re-playing FO3 recently, this game feels absurdly easy. Caps in every single nook and cranny of the wastela-Commonwealth, med supplies everywhere, and every single object being expendable for supplies ironically takes the fun out of exploring. There's never really a feeling of satisfaction when you go through a building or a long quest, because you inevitably come out 10x richer and heavier than when you went in. 

Every time I was blown away by the graphics, I would look in another direction at a cartoon-y npc or have to engage in a weirdly cinematic & grandiose conversation. I guess my expectations were a lot higher coming back to this game, and though I will continue to replay it, the motivation is quickly diminishing. 

You could say I'm biased towards FO3/NV, and you would be correct. I miss the entire solar system freezing to engage in conversation, and finding 4 caps and a pack of mentats in a random locker that had an expert-rated lock on it. FO4 is still a fun game, but certainly feels standalone this time around.",1754013304,1754013304,True,0,0,0.5,0,True,False,False,False,76561198309224838,0,2,225,225,225,1754012366,
201176169,english,"as someone who's put 6 years worth of time on the playstation and 45 hours on pc, fallout 4 is pretty cool. DLCs are worth it, healthy modding community, and still fun 10 years after release. 8/10, sometimes launch is buggy",1754006155,1754006155,True,0,0,0.5,0,True,False,False,False,76561199090797519,42,5,3742,2276,2722,1754607799,
201175086,english,i spent 12 hours modding,1754004581,1754004581,True,0,0,0.5,0,True,False,False,False,76561198376350529,28,7,3750,3747,991,1754602064,
201174652,english,"this is one of the best games I have ever played. I knew I would like it when I first bought it, and I was definitely right",1754004018,1754004018,True,0,0,0.5,0,True,False,False,False,76561199797477785,7,1,18609,259,18591,1754237550,1467.0
201173658,english,I've been playing Fallout since 3 and of course this game has endless amounts of content (especially if you include the extensive modding community). If you have hours of your life to sink into something make it this.,1754002634,1754002634,True,0,0,0.5,0,True,False,False,False,76561198165987506,0,12,73548,4726,69309,1754608235,
201172621,english,Trash time to play more,1754001321,1754001321,False,0,0,0.476190477609634399,0,True,False,False,False,76561199582199983,0,2,5788,2137,5702,1754006757,
201170616,english,"Fallout is a charming, fun franchise. 

It is unfortunately owned by one of the most incompetent game developers ever to grace this earth. The technical aspects of every single one of Bethesda's titles are so abysmally terrible that nothing else matters. I will never ever purchase or support a single one of Todd Howard's games unless some miracle happens (spoiler alert, it won't).",1753998926,1753998926,False,0,0,0.5,0,True,False,False,False,76561198114524690,143,13,16301,0,16301,1732980320,
201167312,english,Downloaded and got black screen on start up,1753995217,1753995223,False,0,0,0.476190477609634399,0,True,False,False,False,76561198138346014,0,1,15,2,13,1754006510,
201166172,english,"Overall Yeah its pretty good. Not as good as 3, Vegas, 1, or 2. After a while the game breaks though...",1753994039,1753994039,True,0,0,0.5,0,True,False,False,False,76561199076678748,105,11,23223,2217,21024,1754450307,
201162588,english,"Fallout 4 is the game I find myself playing the most out of all the Fallout games. The story is not as compelling or well-written as previous Fallout games, but as of now I have the most hours in this game compared to all the others. That is strictly because of how much fun I find the settlement/building system and exploring the setting. The modding potential in this game only makes it better.",1753990199,1753990199,True,0,0,0.5,0,True,False,False,False,76561198079968725,565,8,34941,644,34296,1754603555,
201162254,english,All these clankers in the common wealth finna pmo,1753989796,1753989796,True,0,0,0.5,0,True,False,False,False,76561199013972067,106,26,5740,3481,4208,1754443280,
201159402,english,"Its good. Not as good as Fallout 3 or New Vegas imo, but still fun to play on the side. Settlement building and power armor are sick, and the modding community is sweet. 7/10 buy the base game and all dlc on sale. ",1753986937,1754151866,True,0,0,0.5,0,True,False,False,False,76561199427942100,0,24,5246,1880,5246,1753986024,
201157375,english,Peak.,1753984839,1753984839,True,0,0,0.5,0,True,False,False,False,76561198410487006,0,6,3959,3687,1887,1754436736,
201155373,english,"I've played 81 hours and it's still a snooze fest, can't even be fixed with over 200 mods. If you like copy paste dungeon interiors and an empty open world where all of the locations are filled with nameless raiders devoid of any ideology or dialogue, this game is for you!",1753982822,1753987383,False,0,0,0.476190477609634399,0,True,False,False,False,76561198427974775,175,8,5052,1246,4894,1754500806,
201141240,english,Modding this game is a nightmare.  Constant errors from F4SE (necessary for all mods) and the dreaded XDI.DLL error message will ruin your game no matter how far in the game you are.  If you're not modding enjoy the last decent Bethesda developed game ever.  Doubt there will be another.,1753969224,1753969224,False,1,0,0.489795923233032227,0,True,False,False,False,76561199118898011,0,32,2369,2153,2369,1753968350,
201139740,english,Love this game. Always come back to it,1753967598,1753967598,True,0,0,0.5,0,True,False,False,False,76561198115916895,103,10,36603,0,36603,1747923166,
